{
  "id": "plan-first",
  "name": "Plan First",
  "model_policy": "Use one coding assistant session. Require an explicit implementation plan before edits.",
  "budget_policy": "Spend up to 20% of the task budget on planning.",
  "human_intervention_policy": "Human may challenge the plan once before implementation.",
  "steps": [
    "Read task.md, acceptance.md, and tests.sh.",
    "Inspect the target repo.",
    "Write a short plan with risks and validation.",
    "Implement only after the plan is accepted or self-reviewed.",
    "Run required tests.",
    "Record transcript, diff, test log, review notes, and metrics."
  ]
}

