{
  "id": "plan-first",
  "name": "先计划后编码",
  "model_policy": "使用一个编码助手会话。编辑前必须先给出明确实现计划。",
  "budget_policy": "最多使用 20% 的任务预算做计划。",
  "human_intervention_policy": "实现前，人类可以对计划提出一次质疑。",
  "steps": [
    "阅读 task.zh-CN.md、acceptance.zh-CN.md 和 tests.sh。",
    "检查目标代码仓库。",
    "写出包含风险和验证方式的简短计划。",
    "计划被接受或自审通过后再实现。",
    "运行必跑测试。",
    "记录 transcript、diff、test log、review notes 和 metrics。"
  ]
}

