{
  "id": "baseline",
  "name": "Baseline Single-Agent Coding",
  "model_policy": "Use one coding assistant session with no explicit subagents.",
  "budget_policy": "Stop at the task time budget unless required tests are still failing.",
  "human_intervention_policy": "Human may clarify requirements and approve final diff only.",
  "steps": [
    "Read task.md, acceptance.md, and tests.sh.",
    "Inspect the target repo.",
    "Implement the change.",
    "Run required tests.",
    "Record transcript, diff, test log, review notes, and metrics."
  ]
}

