{
  "id": "baseline",
  "name": "基线单 Agent 编码",
  "model_policy": "使用一个编码助手会话，不显式使用 subagent。",
  "budget_policy": "到达任务时间预算即停止，除非必跑测试仍在失败。",
  "human_intervention_policy": "人类只允许澄清需求和批准最终 diff。",
  "steps": [
    "阅读 task.zh-CN.md、acceptance.zh-CN.md 和 tests.sh。",
    "检查目标代码仓库。",
    "实现变更。",
    "运行必跑测试。",
    "记录 transcript、diff、test log、review notes 和 metrics。"
  ]
}

